Import Date	Metadata Timestamp	Date Last Played	Play State Last Modified	Download Date	Play Count	Author	Title	Subtitle	Asset URL	Web Page URL	Duration	Size	Play State
2020-03-25 19:18:32			2020-03-25 19:18:32		0		DFSP # 120  - Rita	This week I talk about Rita, a free Threat Hunting Tool from Black Hills Information Security		https://digitalforensicsurvivalpodcast.libsyn.com/dfsp-120-rita	1013.0	8276667	0
2020-03-25 19:18:32			2020-03-25 19:18:32		0		DFSP # 138 - OWASP Top 10	This week I talk about OWASP and why you should be paying attention.		https://digitalforensicsurvivalpodcast.libsyn.com/dfsp-138-owasp-top-10	1185.0	9678635	0
2020-03-25 19:18:32			2020-03-25 19:18:32		0		DFSP # 024 - RAM Extraction Tools - Part 1	This episode is a two-parter looking at RAM extraction tools. Part 1 will take a look at why RAM extraction is an important part of forensic analysis. Part 2 will go over an experiment I did with four different tools: DumpIt, Belkasoft's RAM Capturer,...		https://digitalforensicsurvivalpodcast.libsyn.com/dfsp-024-ram-extraction-tools-part-1	1244.0	10200799	0
2020-03-25 19:18:32			2020-03-25 19:18:32		0		DFSP # 193 - LOKI	This week I talk about LOKI, a tool designed to help analyst scan for APT IOCs.		https://digitalforensicsurvivalpodcast.libsyn.com/dfsp-193-loki	909.0	7430595	0
2020-03-25 19:18:32			2020-03-25 19:18:32		0		DFSP # 0016 - Password Psychology	The next mini series will focus on open source password attack tools. There are some pay options out there, however, most IR teams do not have a need for it and disk forensic teams use if infrequently. Despite this many labs want the capability...		https://digitalforensicsurvivalpodcast.libsyn.com/dfsp-0016-password-psychology	1965.0	16096367	0
2020-03-25 19:18:32			2020-03-25 19:18:32		0		DFSP # 180 - Credential Guard	This week I talk about the Windows credential guard process.		https://digitalforensicsurvivalpodcast.libsyn.com/dfsp-180-credential-guard	607.0	4977219	0
2020-03-25 19:18:32			2020-03-25 19:18:32		0		DFSP # 078 - Bitcoin Forensics	This week I provide an overview of Bitcoin forensics for examiners new to these investigations.		https://digitalforensicsurvivalpodcast.libsyn.com/dfsp-078-bitcoin-forensics	1075.0	8811796	0
2020-03-25 19:18:32			2020-03-25 19:18:32		0		DFSP # 203 - Profile of a modern analyst	"This week I start the year with my traditional ""back-to-basics"" episode, focusing on self-improvement themes and goals to consider"		https://digitalforensicsurvivalpodcast.libsyn.com/dfsp-203-profile-of-a-modern-analyst	1014.0	8288906	0
2020-03-25 19:18:32			2020-03-25 19:18:32		0		DFSP # 153 - Google Dorks	This week I talk about the Google Hacking Database.		https://digitalforensicsurvivalpodcast.libsyn.com/dfsp-153-google-dorks	635.0	5207278	0
2020-03-25 19:18:32			2020-03-25 19:18:32		0		DFSP # 031 - Mac User Home Folder	This week I talk about Mac Home Folders to give Mac Examiners an idea of how it is structured and where to look for certain artifacts.		https://digitalforensicsurvivalpodcast.libsyn.com/dfsp-031-mac-user-home-folder	1123.0	9204183	0
2020-03-25 19:18:32			2020-03-25 19:18:32		0		DFSP #004 - Windows Prefetch	Prove file use and knowledge		https://digitalforensicsurvivalpodcast.libsyn.com/test	1112.0	9115640	0
2020-03-25 19:18:32			2020-03-25 19:18:32		0		DFSP # 083 - cree.py	This week I talk about cree.py, an OSINT tool to profile social media accounts by geolocation.		https://digitalforensicsurvivalpodcast.libsyn.com/dfsp-083-creepy	1115.0	9140030	0
2020-03-25 19:18:32			2020-03-25 19:18:32		0		DFSP # 108 - Under the Radare	This week I talk about Cutter, a static malware analysis tool by Radare		https://digitalforensicsurvivalpodcast.libsyn.com/dfsp-108-under-the-radare	965.0	7889935	0
2020-03-25 19:18:32			2020-03-25 19:18:32		0		DFSP # 123 - IP Triage	This week I talk about IP address and domain triage for computer forensic investigations.		https://digitalforensicsurvivalpodcast.libsyn.com/dfsp-123-ip-triage	1378.0	11249763	0
2020-03-25 19:18:32			2020-03-25 19:18:32		0		DFSP # 019 - Password Cracking with Hashcat	The last talk in the Open-Source password cracking series focuses on a tool that rivals the pay tools in function and capability - Hashcat.		https://digitalforensicsurvivalpodcast.libsyn.com/dfsp-019-password-cracking-with-hashcat	1441.0	11804970	0
2020-03-25 19:18:32			2020-03-25 19:18:32		0		DFSP # 097 - The Main Event	"This week I go over some ""go to"" Windows Event Logs."		https://digitalforensicsurvivalpodcast.libsyn.com/dfsp-097-the-main-event	1348.0	11008251	0
2020-03-25 19:18:32			2020-03-25 19:18:32		0		DFSP # 134 -OfficeMalScanner	This week I talk OfficeMalScanner, a malware scanner for Microsoft document		https://digitalforensicsurvivalpodcast.libsyn.com/dfsp-134-officemalscanner	1041.0	8506207	0
2020-03-25 19:18:32			2020-03-25 19:18:32		0		DFSP # 082 - iPhone Forensics on the Cheap	This week I talk how to make a forensic iPhone backup using iTunes and triage of iPhone backup files using free forensic tools.		https://digitalforensicsurvivalpodcast.libsyn.com/dfsp-082-iphone-forensics-on-the-cheap	1298.0	10634924	0
2020-03-25 19:18:32			2020-03-25 19:18:32		0		DFSP # 148 - Threat Hunting Tips	This week I talk about tips for building a threat hunting program.		https://digitalforensicsurvivalpodcast.libsyn.com/dfsp-148-threat-hunting-tips	2057.0	16773051	0
2020-03-25 19:18:32			2020-03-25 19:18:32		0		"DFSP # 035 - ""Recent"" File Listings on a Mac"	This week I talk about where to find different listing of different recently accessed files on a Mac as well as how to break out the data for interpretation.		https://digitalforensicsurvivalpodcast.libsyn.com/dfsp-035-recent-file-listings-on-a-mac	1417.0	11610437	0
2020-03-25 19:18:32			2020-03-25 19:18:32		0		DFSP # 064 - Chrome Forensics	This week it's back to browsers with Chrome Forensics.		https://digitalforensicsurvivalpodcast.libsyn.com/dfsp-064-chrome-forensics	1108.0	9079079	0
2020-03-25 19:18:32			2020-03-25 19:18:32		0		DFSP # 208 - Persistence Fast Triage	This week I talk about a fast triage methodology to detect persistence on Windows systems		https://digitalforensicsurvivalpodcast.libsyn.com/dfsp-208-persistence-fast-triage	1152.0	9412659	0
2020-03-25 19:18:32			2020-03-25 19:18:32		0		DFSP # 056 - Surviving Solid State Drives	This week I go over my survival tips for imaging solid state drives (SSDs).		https://digitalforensicsurvivalpodcast.libsyn.com/dfsp-056-surviving-solid-state-drives	912.0	7478084	0
2020-03-25 19:18:32			2020-03-25 19:18:32		0		DFSP # 086 - BambiRaptor	This week I review a freely available Windows Live Response collection tool available from BriMor Labs.		https://digitalforensicsurvivalpodcast.libsyn.com/dfsp-086-bambiraptor	879.0	7207709	0
2020-03-25 19:18:32			2020-03-25 19:18:32		0		DFSP # 168 - Is CEH Still Relevant?	I recently passed my certified ethical hacker certification test. This week I thought I would talk about why I chose the certification.		https://digitalforensicsurvivalpodcast.libsyn.com/dfsp-168-is-ceh-still-relevant	952.0	7781151	0
2020-03-25 19:18:32			2020-03-25 19:18:32		0		DFSP # 046 - DFIR New Year	This week I share my thoughts on setting DFIR goals for the coming year. I go over seven points worth focusing on for professional development.		https://digitalforensicsurvivalpodcast.libsyn.com/dfsp-046-dfir-new-year	1863.0	15256489	0
2020-03-25 19:18:32			2020-03-25 19:18:32		0		DFSP # 143 - Tips from the Trenches	Tips from the DFIR Trenches		https://digitalforensicsurvivalpodcast.libsyn.com/dfsp-143-tips-from-the-trenches	819.0	6705539	0
2020-03-25 19:18:32			2020-03-25 19:18:32		0		DFSP # 040 - Mac Log Files	This week I talk about Mac Log files that are useful for File Use & Knowledge investigations as well as Incident Response.		https://digitalforensicsurvivalpodcast.libsyn.com/dfsp-040-mac-log-files	1351.0	11075553	0
2020-03-25 19:18:32			2020-03-25 19:18:32		0		DFSP # 069 - Automated Memory Triage	This week I take a look at Redline by Mandiant, a tool that offers automated memory triage and much more.		https://digitalforensicsurvivalpodcast.libsyn.com/dfsp-069-automated-memory-triage	1280.0	10488946	0
2020-03-25 19:18:32			2020-03-25 19:18:32		0		DFSP # 050 - Virtual Machine Forensics	This week I talk File Use & Knowledge investigations involving virtual machines. This is mainly from a dead-box exam point-of-view.		https://digitalforensicsurvivalpodcast.libsyn.com/dfsp-050-virtual-machine-forensics	1316.0	10784004	0
2020-03-25 19:18:32			2020-03-25 19:18:32		0		DFSP # 183 - WMI Forensics	This week I talk about using WMI to create processes remotely.		https://digitalforensicsurvivalpodcast.libsyn.com/dfsp-183-wmi-forensics	1323.0	10802655	0
2020-03-25 19:18:32			2020-03-25 19:18:32		0		DFSP # 109 - OLEDump	This week I talk about OLEDump, a malware analysis tool for investigating suspicious macros in MS Office documents		https://digitalforensicsurvivalpodcast.libsyn.com/dfsp-109-oledump	1076.0	8796387	0
2020-03-25 19:18:32			2020-03-25 19:18:32		0		DFSP # 091 - Red Team Field Manual	This week I talk about RTFM, the companion to the blue team field manual that's filled with over 1000 commands for windows and Linux.		https://digitalforensicsurvivalpodcast.libsyn.com/dfsp-091-red-team-field-manual	648.0	5323647	0
2020-03-25 19:18:32			2020-03-25 19:18:32		0		DFSP # 047 - Epoch Time Survival	This week I talk about surviving mobile App timestamps.		https://digitalforensicsurvivalpodcast.libsyn.com/dfsp-047-epoch-time-survival	1325.0	10857121	0
2020-03-25 19:18:32			2020-03-25 19:18:32		0		DFSP #003 - Windows Explorer Evidence	Prove File Use and Knowledge		https://digitalforensicsurvivalpodcast.libsyn.com/dfsp-003-windows-explorer-evidence	995.0	8158884	0
2020-03-25 19:18:32			2020-03-25 19:18:32		0		DFSP # 074 - Detecting Lateral Movement	"This week I review a document put out by the Japan Computer Emergency Response Team Coordination Center on ""Detecting Lateral Movement through Tracking Event Logs."""		https://digitalforensicsurvivalpodcast.libsyn.com/dfsp-074-detecting-lateral-movement	986.0	8082516	0
2020-03-25 19:18:32			2020-03-25 19:18:32		0		DFSP # 012 - Just-Metadata	This episode I talk Just-Metadata, a freely available tool that gathers data about IP addresses from publicly available resources. Check out  to learn more. I put together my quick start notes (below) for anyone interested in getting...		https://digitalforensicsurvivalpodcast.libsyn.com/dfsp-012-just-metadata	842.0	6907085	0
2020-03-25 19:18:32			2020-03-25 19:18:32		0		DFSP # 197 - Approaching Network Forensics	This week I talk about network forensic methodology.		https://digitalforensicsurvivalpodcast.libsyn.com/dfsp-197-approaching-network-forensics	1316.0	10742275	0
2020-03-25 19:18:32			2020-03-25 19:18:32		0		DFSP # 051 - Analyzing PE Signatures	"This week I talk about an openly available library and tool repository  all examiners should be aware of as well as a tool by Didier Stevens called ""AnalyzePESig"" which is perfect for bulk analysis of executables on Windows systems."		https://digitalforensicsurvivalpodcast.libsyn.com/dfsp-051-analyzing-pe-signatures	1158.0	9495687	0
2020-03-25 19:18:32			2020-03-25 19:18:32		0		DFSP # 105 - from Zero to JTAG	This week I interview an industry expert about mobile device JTAG and ISP forensics.		https://digitalforensicsurvivalpodcast.libsyn.com/dfsp-105-from-zero-to-jtag	2216.0	18066231	0
2020-03-25 19:18:32			2020-03-25 19:18:32		0		DFSP # 076 - Strings!	This week I look talk about one of the most versatile tools for forensic triage and analysis - Strings!		https://digitalforensicsurvivalpodcast.libsyn.com/dfsp-076-strings	1197.0	9808534	0
2020-03-25 19:18:32			2020-03-25 19:18:32		0		DFSP # 157 - File Comparison Strategies	This week I discuss some techniques for comparing files and folders for DFIR investigations.		https://digitalforensicsurvivalpodcast.libsyn.com/dfsp-157-file-comparison-strategies	1146.0	9364511	0
2020-03-25 19:18:32			2020-03-25 19:18:32		0		DFSP # 187 - SUDOERS File and Forensics	This week I breakdown the SUDOERS file for forensic triage.		https://digitalforensicsurvivalpodcast.libsyn.com/dfsp-187-sudoers-file-and-forensics	885.0	7237231	0
2020-03-25 19:18:32			2020-03-25 19:18:32		0		DFSP # 055 - Automated Host Intelligence	This week I talk about threat intelligence tool Hostintel by Keith Jones.		https://digitalforensicsurvivalpodcast.libsyn.com/dfsp-055-automated-host-intelligence	1540.0	12619163	0
2020-03-25 19:18:32			2020-03-25 19:18:32		0		DFSP # 128 - GREP vs SED vs AWK	This week I talk the difference between common text processing utilities used in forensic analysis		https://digitalforensicsurvivalpodcast.libsyn.com/dfsp-128-grep-vs-sed-vs-awk	1051.0	8591051	0
2020-03-25 19:18:32			2020-03-25 19:18:32		0		DFSP # 117 - USNJRNL Tool Review	This week I review two tools for extracting and parsing USNJRNL evidence.		https://digitalforensicsurvivalpodcast.libsyn.com/dfsp-117-usnjrnl-tool-review	1093.0	8929375	0
2020-03-25 19:18:32			2020-03-25 19:18:32		0		DFSP # 190 - Dead Simple Boot Disks	This week I go over how to create a boot disk using the native capability of Ubuntu. You'll never have to rely on third-party tools again!		https://digitalforensicsurvivalpodcast.libsyn.com/dfsp-190-dead-simple-boot-disks-0	962.0	7865719	0
2020-03-25 19:18:32			2020-03-25 19:18:32		0		DFSP # 172 - High Optane	This week I talk about Intel's emerging technology called Optane end it anticipated affects on DFIR investigations.		https://digitalforensicsurvivalpodcast.libsyn.com/dfsp-172-high-optane	718.0	5883655	0
2020-03-25 19:18:32			2020-03-25 19:18:32		0		DFSP # 017 - Cracking Passwords with Cain	In the last episode I talked about PW psychology, an important part of operationalizing any PW cracking tool effectively. Face it, the math is against you so understanding a person’s probable PW patterns is important. In this episode we will...		https://digitalforensicsurvivalpodcast.libsyn.com/dfsp-017-cracking-passwords-with-cain	1429.0	11707567	0
2020-03-25 19:18:32			2020-03-25 19:18:32		0		DFSP # 152 - CEWL	This week I talk about CEWL, a freely available tool for crawling websites to produce unique wordlists (think password attacks!)		https://digitalforensicsurvivalpodcast.libsyn.com/dfsp-152-cewl	730.0	5980483	0
2020-03-25 19:18:32			2020-03-25 19:18:32		0		DFSP # 181 - Remote Execution One-Liners	This week I cover a resource you can use to develop windows remote execution triage methodology and threat hunting.		https://digitalforensicsurvivalpodcast.libsyn.com/dfsp-181-remote-execution-one-liners	946.0	7732747	0
2020-03-25 19:18:32			2020-03-25 19:18:32		0		DFSP # 028 - Microcast	This week I am taking a breather and doing some planning for future topics. If you have a topic you would like to see covered mention it in the show notes. Full episodes will return the first week of September.		https://digitalforensicsurvivalpodcast.libsyn.com/dfsp-028-microcast	200.0	1656989	0
2020-03-25 19:18:32			2020-03-25 19:18:32		0		DFSP #003 - What the Shellbag!	Proving fileuse and knowledge		https://digitalforensicsurvivalpodcast.libsyn.com/dfsp-003-what-the-shellbag	1708.0	13992513	0
2020-03-25 19:18:32			2020-03-25 19:18:32		0		DFSP # 052 - Free Your Mind	This week I talk about FreeMind, a freely available visualization tool that can be used to enhance the computer forensic investigation process.		https://digitalforensicsurvivalpodcast.libsyn.com/dfsp-052-free-your-mind	1308.0	10723230	0
2020-03-25 19:18:32			2020-03-25 19:18:32		0		DFSP # 079 - Thoughts on DASH Forensics	This week I talk about crypto currency 2.0 and feature DASH as the example.		https://digitalforensicsurvivalpodcast.libsyn.com/dfsp-079-thoughts-on-dash-forensics	1192.0	9771821	0
2020-03-25 19:18:32			2020-03-25 19:18:32		0		DFSP # 131 - PIDS	This week I talk about PIDS in their uses and computer forensic investigations.		https://digitalforensicsurvivalpodcast.libsyn.com/dfsp-131-pids	1287.0	10512475	0
2020-03-25 19:18:32			2020-03-25 19:18:32		0		DFSP # 189 - NVMe	This week I talk about NVMe, a data storage technology, from a forensic point of view.		https://digitalforensicsurvivalpodcast.libsyn.com/dfsp-189-nvme	956.0	7817327	0
2020-03-25 19:18:32			2020-03-25 19:18:32		0		DFSP # 116 - Automatic Detection of Malware from Memory Analysis	This week I talk about a clever way to leverage Volatility to triage malware on a target system		https://digitalforensicsurvivalpodcast.libsyn.com/dfsp-116-automatic-detection-of-malware-from-memory-analysis	1225.0	10005152	0
2020-03-25 19:18:32			2020-03-25 19:18:32		0		DFSP # 018 - John the Ripper	Last episode I talked about using Cain to attack Windows LANMAN and NTLM hashes. Next we will discuss John the Ripper, Linux password files and rainbow tables.		https://digitalforensicsurvivalpodcast.libsyn.com/dfsp-018-john-the-ripper	1494.0	12242578	0
2020-03-25 19:18:32			2020-03-25 19:18:32		0		DFSP # 096 - OS X Unified Logging	This week I talk about Mac Logs, namely the new Unified Logging in OS X and how this impacts forensic exams.		https://digitalforensicsurvivalpodcast.libsyn.com/dfsp-096-os-x-unified-logging	891.0	7304887	0
2020-03-25 19:18:32			2020-03-25 19:18:32		0		DFSP # 125 - Distributed Hash Cracking	This week I talk about distributed password cracking with Hashtopolis for Hashcat		https://digitalforensicsurvivalpodcast.libsyn.com/dfsp-125-distributed-hash-cracking	1185.0	9678635	0
2020-03-25 19:18:32			2020-03-25 19:18:32		0		DFSP # 146 - Mimikatz Detection	This week I talk about contacting Mimikatz through windows event log.		https://digitalforensicsurvivalpodcast.libsyn.com/dfsp-146-mimikatz-detection	961.0	7853763	0
2020-03-25 19:18:32			2020-03-25 19:18:32		0		DFSP # 036 - iCloud Forensic Evidence	This week I breakdown iCloud forensic artifacts.		https://digitalforensicsurvivalpodcast.libsyn.com/dfsp-036-icloud-forensic-evidence	1475.0	12084294	0
2020-03-25 19:18:32			2020-03-25 19:18:32		0		DFSP # 213 - Trusted Developer Utilities	This week I talk DFIR triage for Microsoft Trusted Dev Utilities		https://digitalforensicsurvivalpodcast.libsyn.com/dfsp-213-trusted-developer-utilities	898.0	7346015	0
2020-03-25 19:18:32			2020-03-25 19:18:32		0		DFSP # 207 - Forensic Grab Bag	This week I talk about tools available on the SIFT workstation... that you may not know or even there!		https://digitalforensicsurvivalpodcast.libsyn.com/dfsp-207-forensic-grab-bag	1053.0	8603023	0
2020-03-25 19:18:32			2020-03-25 19:18:32		0		DFSP # 057 - Webmail Collections	This week I talk about a methodology to collect webmail using freely available tools as well as the things you must consider before you do so.		https://digitalforensicsurvivalpodcast.libsyn.com/dfsp-057-webmail-collections	1203.0	9860263	0
2020-03-25 19:18:32			2020-03-25 19:18:32		0		DFSP # 165 - Windows Core Processes	This week I go over how to approach windows core processes from the standpoint of fast triage methodology. Since these processes are found on all window systems it makes sense to develop and investigative approach that focuses on quickly reviewing...		https://digitalforensicsurvivalpodcast.libsyn.com/dfsp-165-windows-core-processes	925.0	7563583	0
2020-03-25 19:18:32			2020-03-25 19:18:32		0		DFSP # 087 - DFIR Degrees	This week I interview a DFIR professional about his decision to get a Masters Degree in cyber security.		https://digitalforensicsurvivalpodcast.libsyn.com/dfsp-087-dfir-degrees	1848.0	15131783	0
2020-03-25 19:18:32			2020-03-25 19:18:32		0		DFSP # 167 - OWASP: XSS	This week I talk about OWASP's Number 7 vulnerability category from their top 10 list, cross site scripting.		https://digitalforensicsurvivalpodcast.libsyn.com/dfsp-167-owasp-xss	1017.0	8312843	0
2020-03-25 19:18:32			2020-03-25 19:18:32		0		DFSP # 022 - DFIR Certification Planning & Considerations	If you take a look at all the different DFIR certifications that exist today you can easily get overwhelmed. There are so many to choose from it puts meaning to the saying that too many choices is no choice at all. In this episode I take a look at...		https://digitalforensicsurvivalpodcast.libsyn.com/dfsp-022-dfir-certification-planning-considerations	1823.0	14928417	0
2020-03-25 19:18:32			2020-03-25 19:18:32		0		DFSP # 142 - CRON 101	This week I breakdown CRON for the uninitiated.		https://digitalforensicsurvivalpodcast.libsyn.com/dfsp-142-cron-101	764.0	6257907	0
2020-03-25 19:18:32			2020-03-25 19:18:32		0		DFSP # 041 - Trash Talkin'	This week I'm talking .Trash. I cover the forensic basics of this Mac artifact that examiners need to know.		https://digitalforensicsurvivalpodcast.libsyn.com/dfsp-041-trash-talkin	990.0	8122441	0
2020-03-25 19:18:32			2020-03-25 19:18:32		0		DFSP # 070 - Notepad++	This week I talk a Notepad++, a freely available code editing tool with some great options built in that are useful for inspecting forensic artifacts.		https://digitalforensicsurvivalpodcast.libsyn.com/dfsp-070-notepad	1093.0	8957624	0
2020-03-25 19:18:32			2020-03-25 19:18:32		0		DFSP # 177 - PSEXEC Forensics	This week I talk about a popular Windows utility attackers often exploit.		https://digitalforensicsurvivalpodcast.libsyn.com/dfsp-177-psexec-forensics	1073.0	8772183	0
2020-03-25 19:18:32			2020-03-25 19:18:32		0		DFSP # 100 - B2B Shimcache	This week I continue the back to basics series with talk on the Windows Shimcache.		https://digitalforensicsurvivalpodcast.libsyn.com/dfsp-100-b2b-shimcache	1192.0	9739011	0
2020-03-25 19:18:32			2020-03-25 19:18:32		0		DFSP # 048 - Evidence Integrity On-Scene	This week I talk about considerations for digital evidence integrity when collection evidence on-scene from a live system.		https://digitalforensicsurvivalpodcast.libsyn.com/dfsp-048-evidence-integrity-on-scene	1403.0	11501263	0
2020-03-25 19:18:32			2020-03-25 19:18:32		0		DFSP # 182 - Density Scout	This week I talk about Density Scout, an open source tool for malware triage.		https://digitalforensicsurvivalpodcast.libsyn.com/dfsp-182-density-scout	656.0	5376183	0
2020-03-25 19:18:32			2020-03-25 19:18:32		0		DFSP # 092 - New Apple File System	This week I talk about the new file system released by Apple, APFS, and what it means for forensic examiners.		https://digitalforensicsurvivalpodcast.libsyn.com/dfsp-092-new-apple-file-system	1047.0	8580663	0
2020-03-25 19:18:32			2020-03-25 19:18:32		0		DFSP # 161 - Social Engineering Toolkit	This week I talk about all the fun you can have ethically hacking with SET		https://digitalforensicsurvivalpodcast.libsyn.com/dfsp-161-social-engineering-toolkit	1042.0	8518439	0
2020-03-25 19:18:32			2020-03-25 19:18:32		0		DFSP # 026 - File Juicer	File Juicer is an easy to use data carving tool that runs on OS X. Take most any file, drop it on File Juicer, and watch it spin out embedded image, movie, document files and text. Perfect for on-scene triage, lab work and exploring new file types.		https://digitalforensicsurvivalpodcast.libsyn.com/dfsp-026-file-juicer	1039.0	8523490	0
2020-03-25 19:18:32			2020-03-25 19:18:32		0		DFSP # 075 - Capturing Websites as Evidence	This week I look at a methodology of capturing websites as evidence using HTTrack		https://digitalforensicsurvivalpodcast.libsyn.com/dfsp-075-capturing-websites-as-evidence	1139.0	9334402	0
2020-03-25 19:18:32			2020-03-25 19:18:32		0		DFSP # 127 - DNS & Forensics	This week I talk about DNS and forensics		https://digitalforensicsurvivalpodcast.libsyn.com/dfsp-127-dns-forensics	1213.0	9908175	0
2020-03-25 19:18:32			2020-03-25 19:18:32		0		DFSP # 058 - Linux FU&K Artifacts	This week I talk Linux forensics and breakdown some useful artifacts that may generate leads for investigations.		https://digitalforensicsurvivalpodcast.libsyn.com/dfsp-058-linux-fuk-artifacts	1417.0	11610147	0
2020-03-25 19:18:32			2020-03-25 19:18:32		0		DFSP # 112 - Port Forensics?	This week I talk how common ports plays into network forensics.		https://digitalforensicsurvivalpodcast.libsyn.com/dfsp-112-port-forensics	950.0	7769179	0
2020-03-25 19:18:32			2020-03-25 19:18:32		0		DFSP # 013 - Windows 10 Artifacts	In this episode I cover something I have been intending to do for some time: a Windows 10 artifacts overview. Here, I explore some key artifacts changes and what has stayed the same. Once I got into it I found there was a lot to talk about so, to...		https://digitalforensicsurvivalpodcast.libsyn.com/dfsp-13-windows-10-artifacts	1491.0	12218083	0
2020-03-25 19:18:32			2020-03-25 19:18:32		0		DFSP # 027 – Mac as a forensic platform	This week I go over some of my top reasons why Macs should be considered as a computer forensic platform.		https://digitalforensicsurvivalpodcast.libsyn.com/dfsp-027-mac-as-a-forensic-platform	1851.0	15159144	0
2020-03-25 19:18:32			2020-03-25 19:18:32		0		DFSP # 156 - B2B: Career Maintenance	This week I share my thoughts on assessing DFIR career path progression.		https://digitalforensicsurvivalpodcast.libsyn.com/dfsp-156-b2b-career-maintenance	1687.0	13763779	0
2020-03-25 19:18:32			2020-03-25 19:18:32		0		DFSP # 025 - RAM Extraction Tools - Part 2	This is part two of RAM extraction tools. Part 1 looked at why RAM extraction is an important part of forensic analysis. In Part 2 the results of a benchmark experiment with four different RAM Extraction tools is discussed: DumpIt,...		https://digitalforensicsurvivalpodcast.libsyn.com/dfsp-025-ram-extraction-tools-part-2	1779.0	14575645	0
2020-03-25 19:18:32			2020-03-25 19:18:32		0		DFSP # 135 - Scheduled Task Triage Part 1	This week I talk about details about what to look at in Scheduled Task records for forensic triage.		https://digitalforensicsurvivalpodcast.libsyn.com/dfsp-135-scheduled-task-triage-part-1	805.0	6584783	0
