2020-03-25 19:19:38			2020-03-25 19:19:38		0		CultCast #280 - The iPhone 8 leaks begin!  🙌🏼	This week: we deconstruct the new iPhone 8 leaks! We’ll tell what we’ve learned.     Plus: Apple starts testing the driverless car they’re totally not working on; and the best iOS apps for all you marijuana connoisseurs.    ...		http://thecultcast.libsyn.com/cultcast-280-the-iphone-8-leaks-begin	3066.0	82610502	0
2020-03-25 19:19:38			2020-03-25 19:19:38		0		CultCast #87  - The Gold Member	Rumor has that Apple might soon get a golden member… of the iPhone family.  But on this week's CultCast, we'll ask the important question: would anyone want a gold iPhone?!  We'll ponder the color choice and rumors of a big bump in 5S...		http://thecultcast.libsyn.com/cult-cast-87-the-gold-member	2933.0	23573476	0
2020-03-25 19:19:38			2020-03-25 19:19:38		0		LEANDER'S GOT A BUS PLAN (CultCast extra)	Leander's got his bus ride to the Who concert all worked out		http://thecultcast.libsyn.com/leanders-got-a-bug-plan-cultcast-extra	115.0	2937776	0
2020-03-25 19:19:38			2020-03-25 19:19:38		0		CultCast #176 - Rustling The Papers	Apple Watch, inbound!  And now that it is, we’ll take a look at some of the most useful Watch apps available, and just for fun, some of the stinkiest.  Plus: the noteworthy differences between the Sport and Steel; why...		http://thecultcast.libsyn.com/cultcast-176-rustling-the-papers	3344.0	82053180	0
2020-03-25 19:19:38			2020-03-25 19:19:38		0		CultCast #138 - Buster’s Beard Kits	This week: with over 300,000 followers, we welcome back professional (and paid!) Instagram’er Cory @WithHearts Staudacher to share his iPhone photo editing tips and reveal which camera apps he relies on daily.  Plus, why our cities deserve...		http://thecultcast.libsyn.com/cultcast-138-busters-beard-kits	3590.0	74502162	0
2020-03-25 19:19:38			2020-03-25 19:19:38		0		CultCast #182 - Hashtag iCar	This week: don’t expect hardware… we’ll tell you why the 2015 WWDC could be one of the tamest on record.  Plus: Apple pretty much confirms Apple TV will be your home’s digital hub; Facebook’s...		http://thecultcast.libsyn.com/cultcast-182-hashtag-icar	3609.0	89508732	0
2020-03-25 19:19:38			2020-03-25 19:19:38		0		CultCast #126 - Leander's Ice Creams	This time: No—those rumored new EarPods won’t measure your pulse—last week's biggest Apple rumor was a fake made up by a guy on a toilet! Plus, why you shouldn’t expect new hardware at June’s WWDC; iPhone warns you...		http://thecultcast.libsyn.com/cultcast-126-leanders-ice-creams	3430.0	49119661	0
2020-03-25 19:19:38			2020-03-25 19:19:38		0		CultCast #330 - 💥 Apple ditches Intel 💥	This week:   Whoa!  Apple just stole Google’s head of A.I. to make Siri smarter Apple plans to ditch Intel processors on the Mac  You won’t believe the massive cash being pay to silicon valley’s A.I. talent Future iPhones could...		http://thecultcast.libsyn.com/cultcast-330-apple-ditches-intel	2508.0	49149945	0
2020-03-25 19:19:38			2020-03-25 19:19:38		0		CultCast 287 - Reactions to the best WWDC in years 🔥	This week: in one of the most exciting and action-packed keynotes in years, Apple updates just about everything they’ve got.  Hot off the event, catch our reactions plus our picks for best in show!   This episode supported by   Build...		http://thecultcast.libsyn.com/cultcast-287-reactions-to-the-best-wwdc-in-years	2863.0	77736680	0
2020-03-25 19:19:38			2020-03-25 19:19:38		0		CultCast #271 - BIG changes coming to iPhone 8 📱 🎉	This week:  iPhone 8 is getting a huge makeover with edge-to-edge screen, wireless charging, huge battery, and more. We’ll fill you in. End of the Home Button and Touch ID. The riches you’d have if you bought Apple IPO stock A 4K Apple...		http://thecultcast.libsyn.com/cultcast-271-big-changes-coming-to-iphone-8	3528.0	64318243	0
2020-03-25 19:19:38			2020-03-25 19:19:38		0		CultCast #77 - Lady Edition	"You know we couldn't possibly cover all of WWDC in just one special episode, so we're back with even more, this time joined by Wired writer Christina Bonnington who attended the keynote, to discuss our favorite features of iOS 7 and why it's still ""a..."		http://thecultcast.libsyn.com/cult-cast-77-lady-edition	2771.0	22294064	0
2020-03-25 19:19:38			2020-03-25 19:19:38		0		CultCast #50 - We forgot it was 50!	"It's all business on this, our 50th episode of The CultCast!
We'll tell you why the New Year broke your iPhone's Do Not Disturb feature; why the iPhone 6 is already showing up in the web logs of some developers; and why Bill Gates wouldn't give his..."		http://thecultcast.libsyn.com/cult-cast-50-we-forgot-it-was-50	3046.0	26604312	0
2020-03-25 19:19:38			2020-03-25 19:19:38		0		CultCast #275 - How Apple will make iPad SEXY again 📱💄💋	This week: Apple’s about to overhaul the iPad, and it’s long overdue!  Plus: why Steve Jobs was cool with your kids using an iPad, but not his own; how the technology we love might be making us all stupid;  and we wrap up...		http://thecultcast.libsyn.com/cultcast-275-how-apple-will-make-ipad-sexy-again	3096.0	74297596	0
2020-03-25 19:19:38			2020-03-25 19:19:38		0		CultCast #97 - This One's For The Pukers	The big Apple event might be over, but there are still plenty of great Apple stories to chat over! On this CultCast: the iPhone stops giving motion sickness to the pukers; some of your favorite Apple apps just got big redesigns; the new Macbook Pro...		http://thecultcast.libsyn.com/cult-cast-97-this-one-s-for-the-pukers	1742.0	15467377	0
2020-03-25 19:19:38			2020-03-25 19:19:38		0		#380 - New Macs!  New iPads!  New AirPods!  We REACT	This week: Apple just released so much new hardware, they had to do it over 3 full days. We break it all down, and react to all the new gear. Plus, the saga of MoviePass continues with yet another new wild announcement… but is their new unlimited...		http://thecultcast.libsyn.com/380-new-macs-new-ipads-new-airpods-we-react	3312.0	62024333	0
2020-03-25 19:19:38			2020-03-25 19:19:38		0		CultCast #368 - The best (and most disappointing!) Apple tech of 2018!	This week: it’s our list of the best—and most disappointing—Apple tech of 2018! And stay tuned for all our most favorite news, movies, food, gear, video games, and drug paraphernalia of the year. This one gets real weird... This episode...		http://thecultcast.libsyn.com/cultcast-368-the-best-and-most-disappointing-apple-tech-of-2018	3286.0	55036033	0
2020-03-25 19:19:38			2020-03-25 19:19:38		0		CultCast #353 - Our Gather Round event reactions!	This week: hot off the heels of Apple’s keynote, it’s our unfiltered Gather Round event reactions!  We'll tell you what we think about iPhone Xs, Xs Max, iPhone Xr, and the new Apple Watch 4. Plus: is it worth upgrading from X to Xs?  We...		http://thecultcast.libsyn.com/cultcast-353-our-gather-round-event-reactions	3916.0	71687140	0
2020-03-25 19:19:38			2020-03-25 19:19:38		0		CultCast #27 - God Save The Queen	"Leander is back for CultCast #27, and boy is he ready to GUV it up!
Join team CultCast as we discuss the recent Jobs home burglary; why the Apple TV might soon be live-streaming; more iPhone 5 rumors;  and then the big September 12th media..."		http://thecultcast.libsyn.com/cult-cast-27-god-save-the-queen	3095.0	42643366	0
2020-03-25 19:19:38			2020-03-25 19:19:38		0		#403 - 🔥 Our September 10th event hardware predications 🔥	This week: Confirmed! Apple’s September 10th has just been announced—don’t miss our hardware and software predictions! Plus: comparing Disney’s new streaming service to Apple TV Plus; Steve Jobs is spotted in Egypt; and one of Earth’s...		http://thecultcast.libsyn.com/403-our-september-10th-event-hardware-predications	3189.0	51013091	0
2020-03-25 19:19:38			2020-03-25 19:19:38		0		#393 - BIG changes coming to iPhone	This week: new iPhone rumors point to some BIG changes… Plus: Leander gives his take on the new betas; two long-awaited features are finally coming to tvOS; and scientists say iPhone is making teenagers too... horny This episode supported by Easily...		http://thecultcast.libsyn.com/393-big-changes-coming-to-iphone	3041.0	49759174	0
2020-03-25 19:19:38			2020-03-25 19:19:38		0		CultCast #192 - #Bendgate Confirmed	This week: ever wonder what it’s like to have companies pay you to travel the world snapping their Instagram photos? Professional Instagram’er  is back to share his workflows, favorite iOS photo apps—and you won’t believe...		http://thecultcast.libsyn.com/cultcast-192-bendgate-confirmed	3594.0	83518137	0
2020-03-25 19:19:38			2020-03-25 19:19:38		0		CultCast #290 - Camaraderie, chaos, and the original iPhone launch stories you’ve never heard	This week: you’d never know it from Steve Job’s effortless keynote introduction, but the original iPhone was plagued with huge design and production issues that almost made Apple call it quits, right up until the day it was released!...		http://thecultcast.libsyn.com/cultcast-290-the-chaotic-iphone-launch-stories-youve-never-heard	4063.0	84967112	0
2020-03-25 19:19:38			2020-03-25 19:19:38		0		CultCast #306 - The iPhone X pre-order strategies you need to know about!	This week: you’ll have mere seconds to lock down your iPhone X pre-order on October 27th, and if you’re not ready, you’ll be waiting months!  We’ve got the strategies you’ll need to employ to have your order placed seconds after the X...		http://thecultcast.libsyn.com/cultcast-306-the-iphone-x-pre-order-strategies-you-need-to-know-about	3519.0	65338758	0
2020-03-25 19:19:38			2020-03-25 19:19:38		0		CultCast #34 - Welcome To The WozCast!	"Don't adjust your volume, that really is Steve Woz you're hearing on this episode of The CultCast! 
And what an episode it shall be!  Hear Steve's thoughts on Apple's new maps strategy; his opinions on Apple's shiny new iPhone 5; and of..."		http://thecultcast.libsyn.com/cult-cast-34-welcome-to-the-woz-cast	2600.0	35266687	0
2020-03-25 19:19:38			2020-03-25 19:19:38		0		CultCast #84 - Apple Giveth And Apple Taketh	Hold onto your butts, because on this ep., we're joined by Adam Christianson from the super popular MacCast podcast to discuss: why the low-cost iPhone 5C is a unicorn you might soon see… we'll cover the recent rumors; also, Apple just seeded...		http://thecultcast.libsyn.com/cult-cast-84-apple-giveth-and-apple-taketh	3078.0	30515096	0
2020-03-25 19:19:38			2020-03-25 19:19:38		0		#385 - Industrial Design Team shakeup!	This week: some major changes are in store for Apple’s legendary industrial design team… we discuss. Plus: Apple commits to fixing all MacBook keyboard issues in just ONE day. This is huge. And it looks like not one but TWO new versions of the...		http://thecultcast.libsyn.com/385-industrial-design-team-shakeup	3470.0	55508660	0
2020-03-25 19:19:38			2020-03-25 19:19:38		0		CultCast #304 - Steve Job’s greatest product	This week: a company unlike any other, some say Steve Job’s greatest product was Apple itself, but how have they fared in the 6 years since his passing?  Leander shares the cold hard facts.  Plus: Leander’s long soliloquy about his new...		http://thecultcast.libsyn.com/cultcast-304-steve-jobs-greatest-product	4580.0	82308738	0
2020-03-25 19:19:38			2020-03-25 19:19:38		0		CultCast #174 - Love Bracelets	This week:  get’em while they’re hot! The Apple Watch is ready for pre-order, but the reviews are in, and they’re a mixed bag. Plus: what’s good in iOS 8.3 and OS X 10.10.3; how to get a free month of HBO NOW;...		http://thecultcast.libsyn.com/cultcast-174-love-bracelets	3840.0	87907182	0
2020-03-25 19:19:38			2020-03-25 19:19:38		0		CultCast #231 - Age of wonder!	This week: Apple aims to end music downloads; you can now live stream your aerial drone flights to iDevices worldwide;  staggering facts about who’s making money in the app store; creators of Siri demo an even smarter AI; the ridiculous resale...		http://thecultcast.libsyn.com/cultcast-231-age-of-wonder	3769.0	59445422	0
2020-03-25 19:19:38			2020-03-25 19:19:38		0		CultCast #254 Hello, indeed!	This week: is Apple is about to make massive updates across the entire Mac line?  Don’t miss our Oct. 27 Mac event predictions!  Plus: everything we know about Nintendo Switch, and why we already love it.      This episode supported...		http://thecultcast.libsyn.com/cultcast-254-hello-indeed	3234.0	52419848	0
2020-03-25 19:19:38			2020-03-25 19:19:38		0		CultCast #10 - 12 Years With Steve	"In the 12 years advertising executive Ken Segall worked closely with Steve Jobs, he named the iMac, and also helped develop Apple's famous Think Different ad campaign.  
Ken has a new book out, titled, Insanely Simple: The Obsession That Drives..."		http://thecultcast.libsyn.com/ep-10-12-years-with-steve	1805.0	34911373	0
2020-03-25 19:19:38			2020-03-25 19:19:38		0		#417 - Big change coming to MacBook Pro (and iPad!)	This week: Apple is readying a new display technology that could be huge change for MacBook Pro and iPad; our favorite Black Friday hauls; and it’s time for our favorite Gear of the Year!  Plus our favorite movies, TV shows, and all...		http://thecultcast.libsyn.com/417-big-change-coming-to-macbook-pro-and-ipad	3781.0	61592372	0
2020-03-25 19:19:38			2020-03-25 19:19:38		0		CultCast #15 - The Wisdom Of Tim C At All Things D	"Apple CEO Tim Cook just took the stage at the All Things D Conference.  How'd he do?  What'd he reveal about Siri, Apple's secret TV, and Steve Jobs?  We cover it all on this week's CultCast. 
And don't miss us chat about the..."		http://thecultcast.libsyn.com/cult-cast-15-the-wisdom-of-tim-c-at-all-things-d	3261.0	64179199	0
2020-03-25 19:19:38			2020-03-25 19:19:38		0		CultCast #311 - The rocky history of HomePod	This week:  HomePod’s been delayed, we’ll talk about that, but Bloomberg put out an interesting piece on the history of the HomePod, and it gives previously undisclosed details of the device you may find very interesting. We gotta talk about net...		http://thecultcast.libsyn.com/cultcast-311-the-rocky-history-of-homepod	4340.0	78470618	0
2020-03-25 19:19:38			2020-03-25 19:19:38		0		CultCast #208 - The Tickler	This week: though Apple spends far less on research and development than the competition, they out innovate them all.  How?  Hit play to catch the discussion.  Plus: iPhone 7 may ditch the beloved headphone jack; Amazon Video is coming...		http://thecultcast.libsyn.com/cultcast-208-the-tickler	4398.0	93328508	0
2020-03-25 19:19:38			2020-03-25 19:19:38		0		CultCast #58 - Ohhhhh Myyyy!	"Hot out the oven, a new iOS 6 jailbreak!  We'll tell you why you should and shouldn't hack into your precious iPhone.
Then, what's next for Mac Pro, the apps and gear you need to live an iPad-only life, and our favorite apps and tech on an..."		http://thecultcast.libsyn.com/cult-cast-58-ohhhhh-myyyy	2977.0	24583542	0
2020-03-25 19:19:38			2020-03-25 19:19:38		0		CultCast #248 - iPhone 7 event reactions!	This episode: our iPhone 7 event reactions! iPhone 7, AirPods, the new Apple Watch—we’ll cover everything Apple announced this week, and tell you what we like, what we don’t, and what we’ll be spending our own hard-earned monies on....		http://thecultcast.libsyn.com/cultcast-248-iphone-7-event-reactions	3744.0	67772913	0
2020-03-25 19:19:38			2020-03-25 19:19:38		0		CultCast #127 - Straight Outta Cupertino	If all the reports ring true, Apple is about to embark on their largest acquisition ever, and the ramifications could be massive. And on this episode of The CultCast, we dissect the Apple/Beats merger, and ask the questions: what could Apple possibly...		http://thecultcast.libsyn.com/cultcast-127-straight-outta-cupertino	3149.0	46054708	0
2020-03-25 19:19:38			2020-03-25 19:19:38		0		CultCast #201 - Yaba daba dooooo	This week:  the pros and cons of Apple’s new 4K and 5K iMacs.  Plus: the new Magic Keyboard, Magic Mouse 2, and Magic Trackpad 2—we’ve got our grubby hands on Apple’s new peripherals and we’re...		http://thecultcast.libsyn.com/cultcast-201-yaba-daba-dooooo	8495.0	187385348	0
2020-03-25 19:19:38			2020-03-25 19:19:38		0		CultCast #362 - Black Friday steals, MacBook Pro’s new GPU, and Steve Jobs stories	This week:    How to get the best Black Friday deals most shoppers miss!   The New MacBook Pro GPUs are a huge upgrade for a meager cost   Erfon's quest to get Apple to upgrade his two-month-old MBP!   We have to talk about iPhone XR....		http://thecultcast.libsyn.com/cultcast-363-black-friday-steals-macbook-pros-new-gpu-and-steve-jobs-stories	2967.0	56500593	0
2020-03-25 19:19:38			2020-03-25 19:19:38		0		#418 - Whoa, Mac Pro is a MONSTER	This week on : The new Mac Pro proves Apple’s still got it! We cover our first impressions, plus discuss some of the insane upgrades available for Apple’s new powerhouse Mac. Plus, we reveal more of our favorite tech, shows, movies, and more in...		http://thecultcast.libsyn.com/418-whoa-mac-pro-is-monster	3873.0	63074644	0
2020-03-25 19:19:38			2020-03-25 19:19:38		0		CultCast #73 - Classy 'n Sassy	"This week on CultCast: Apple Chief Tim Cook brings his Southern charm to Washington, hints at an iHologram; we make sense of the Apple tax debaucle; and Xbox One vs. Apple TV, should Apple be worried?
All that and more on this week's CultCast!
Thanks..."		http://thecultcast.libsyn.com/cult-cast-73-classy-n-sassy	2741.0	22054982	0
2020-03-25 19:19:38			2020-03-25 19:19:38		0		#411 - New MacBook Pro LEAKS	"This week on : The new 16-inch MacBook Pro just leaked, but its ""new design"" has a lot people disappointed. Plus, we'll tell you why 2020 could deliver Apple's impressive hardware in years. And stick around for our favorite new router, mouse,..."		http://thecultcast.libsyn.com/411-new-macbook-pro-leaks	3708.0	60434583	0
2020-03-25 19:19:38			2020-03-25 19:19:38		0		CultCast #163 - What Would Yeezus Do	This week: why Apple Watch will win the wrist war; we snap a pic with Patrick Stewart and he’s NOT amused; the good and bad of a Lucas-free Star Wars 7; Microsoft’s new Hololens look incredible; and we reveal some...		http://thecultcast.libsyn.com/cultcast-163-what-would-yeezus-do	3568.0	84012520	0
2020-03-25 19:19:38			2020-03-25 19:19:38		0		CultCast #25 - OS X Snoop Lion	"Hard to believe we're already at episode 25!  And what an episode this will be, friends.
Find out all we know about Apple's mystery September 12th event, and what new goodies they will be revealing unto us  that fine day.
Then, is the iPhone..."		http://thecultcast.libsyn.com/cult-cast-25-os-x-snoop-lion	4610.0	62322536	0
2020-03-25 19:19:38			2020-03-25 19:19:38		0		CultCast #12 - Apple's HDTV Revealed!	"We spill the beans in this ep, revealing everything our secret Apple source told us about Apple's upcoming HDTV.
Plus, what the craziest Apple fan we've ever seen just did to prove his worthiness, and then we reveal our favorite apps of the week - all..."		http://thecultcast.libsyn.com/cult-cast-12-apple-s-hdtv-revealed	2487.0	40896101	0
2020-03-25 19:19:38			2020-03-25 19:19:38		0		CultCast #261 - Apple’s next big thing?	This week: why Apple is done chasing big hit products.  Plus: the demise of Pebble Watch is a bad omen for wearables; Foxconn secretly prepares to make more Apple products in the US; and we remember our favorite movies of...		http://thecultcast.libsyn.com/cultcast-261-apples-next-big-thing	3920.0	70581335	0
2020-03-25 19:19:38			2020-03-25 19:19:38		0		CultCast #243 - Bustin' a squirt	This week: the controversy around iOS 10’s new gun emoji;  we compare Instagram’s new stories feature to Snapchat's; Gwyneth Paltrow brings her coding skills to ‘Planet of the Apps’; we attended a 5-day Apple II festival,...		http://thecultcast.libsyn.com/cultcast-243-bustin-a-squirt	2615.0	41837215	0
2020-03-25 19:19:38			2020-03-25 19:19:38		0		#384 - Are we too critical of Apple?	This week: is the CultCast crew too critical of Apple? Some say yes. We discuss! Plus, we talk about the pros and cons of Apple’s reported modular Mac Pro. And we’ll look at why Samsung’s new folding phone is already breaking! And this fatal...		http://thecultcast.libsyn.com/cultcast-384-are-we-too-critical-of-apple	3045.0	48718495	0
2020-03-25 19:19:38			2020-03-25 19:19:38		0		CultCast #339 - WWDC 2018 Reactions! (And our best-of-show picks)	This week: It’s our WWDC 2018 reactions! Plus—our picks for the best new features announced at the keynote.   This episode supported by   Casper’s American-made mattresses have just the right amount of memory foam and latex, and people...		http://thecultcast.libsyn.com/cultcast-339-wwdc-2018-reactions-and-our-best-of-show-picks	3913.0	71644509	0
2020-03-25 19:19:38			2020-03-25 19:19:38		0		CultCast #217 - Super Brawl!	This week: new hardware, incoming! We’ll tell you our expectations of Apple’s rumored March 2016 event.  Plus, why the next iPad Air could be the best one yet; iPhone 7 may have far fewer features than expected; and, is Apple making a...		http://thecultcast.libsyn.com/cultcast-217-super-brawl	3412.0	63392075	0
2020-03-25 19:19:38			2020-03-25 19:19:38		0		CultCast #319 - How Apple’s going to spend its MASSIVE fortune 💰🎉	This week: Tim Cook is THRILLED with the US’ new tax overhaul, and has some exciting plans to spend Apple’s massive fortune.  Plus: forget other smart speakers—we’re tell you why we’re now even more excited for HomePod.  And stick...		http://thecultcast.libsyn.com/cultcast-319-how-apples-going-to-spend-its-massive-fortune	3432.0	63937759	0
2020-03-25 19:19:38			2020-03-25 19:19:38		0		CultCast #76 - No Cows Were Harmed	This time 'round on CultCast: iOS 7 debuts to a standing ovation, but some aren't in love;  OS X 10.9 Mavericks will have you rewatching Top Gun, we'll highlight the new features; new MacBook Airs get insanely long battery life and more power;...		http://thecultcast.libsyn.com/cult-cast-76-no-cows-were-harmed	3528.0	28453664	0
2020-03-25 19:19:38			2020-03-25 19:19:38		0		CultCast #218 - The Beak made ‘im do it	"This week: neighbors complain of peculiar “motor noises"" emanating from Apple’s secret auto labs; the strange error that’s bricking iPhones everywhere (and how to avoid it); and, has Apple lost their way?  Some pundits are..."		http://thecultcast.libsyn.com/cultcast-218-the-beak-made-im-do-it	2814.0	58398825	0
2020-03-25 19:19:38			2020-03-25 19:19:38		0		CultCast #249 - #JazzHands	This week: should you buy Airpods?  The reviews are in, and we’re excited.  Plus: the iPhone 7 carrier deals you need to know about; iPhone 7 smashes pre-order expectations; Series 1 vs. Series 2 Apple Watch; and,...		http://thecultcast.libsyn.com/cultcast-249-jazzhands	3110.0	57629430	0
2020-03-25 19:19:38			2020-03-25 19:19:38		0		CultCast #318 -  The weirdest, whackiest, & wonderfullest gadgets of CES 2018!	This week: our list of the weirdest, whackiest, and wonderfullest gadgets of CES 2018!  Plus: Stevie Wonder, Stevie Nicks, and hanging with Andy Dick—we remember our favorite stories from CES's of years past.   This episode supported by...		http://thecultcast.libsyn.com/cultcast-318-the-weirdest-whackiest-wonderfullest-gadgets-of-ces-2018	4183.0	75957847	0
2020-03-25 19:19:38			2020-03-25 19:19:38		0		CultCast #211 - Kanye Cobra	"This week: Apple let’s us all in to their super secret design lab, and what we find is amazing; the best of the holiday iOS App Store deals; and we pick our favorite movies of 2015!
 
This episode supported..."		http://thecultcast.libsyn.com/cultcast-211-kanye-cobra	4083.0	95566263	0
2020-03-25 19:19:38			2020-03-25 19:19:38		0		CultCast #133 - Sexy Pixels	This week on the CultCast: Leander’s Big Adventure!  Leander’s back to tell us about his top secret mission to Apple HQ.  CoM reviews editor Charlie Sorrell tells us about some cool gear he’s reviewing.  We also run...		http://thecultcast.libsyn.com/cultcast-133-sexy-pixels	4366.0	77746789	0
2020-03-25 19:19:38			2020-03-25 19:19:38		0		CultCast #53 - Day 3 Live From CES 2013	"Live from CES 2013 in Vegas - day 3!
The Consumer Electronics Show is now officially open for business, and team Cult spent the day scouring the massive halls looking for the best booths and tech.
On our newest episode, we recount cool tech we've..."		http://thecultcast.libsyn.com/cult-cast-53-day-3-live-from-ces-2013	2849.0	38497327	0
2020-03-25 19:19:38			2020-03-25 19:19:38		0		CultCast #336 - Don’t buy a MacBook Pro until you hear this episode	Don’t buy any new MacBook Pro until you hear this episode—seriously.     There are growing reports, tons of complaints, and a new petition claiming the butterfly keyboard in the new MacBook Pro has a critical design flaw that can’t be...		http://thecultcast.libsyn.com/cultcast-336-dont-buy-a-macbook-pro-until-you-hear-this-episode	3641.0	67281850	0
2020-03-25 19:19:38			2020-03-25 19:19:38		0		CultCast #195 - Leak-tacular!	"This week: here comes iPhone 6S, iPad Pro, and a drastically new Apple TV!  We’ll tell you what to expect from Apple’s Sept. 9th event, because this event is fixing to be a doozie.
 
Our thanks to  for supporting this..."		http://thecultcast.libsyn.com/cultcast-195-leak-tacular	3345.0	86971568	0
2020-03-25 19:19:38			2020-03-25 19:19:38		0		CultCast #279 - Undercover in an iPhone production factory!	This week:  Official new Nvidia drivers make your Mac compatible with the best GPUs on the market! A mole gives us our best look yet at what it’s really like to work in an iPhone factory Apple has a secret team working on ‘breakthrough’...		http://thecultcast.libsyn.com/cultcast-279-undercover-in-an-iphone-production-factory	3603.0	95499737	0
