2020-03-25 19:19:38			2020-03-25 19:19:38		0		#406 - iPhone 11 Pro - A leap forward!	This week: iPhone 11 Pro’s cameras are the largest leap forward yet. We’ll tell why the cameras alone make iPhone 11 and iPhone 11 Pro worth the upgrade. Plus: iPhone 11 Pro may have dual wireless charging built in after all; and it looks like...		http://thecultcast.libsyn.com/iphone-11-pro-a-leap-forward	2953.0	48353535	0
2020-03-25 19:19:38			2020-03-25 19:19:38		0		CultCast #81 - Room For Squares	This time on CultCast: tons of apps go free for Apple's 5th Appaversary; an updated retina Macbook Pro is close at hand; iPad Mini COULD go retina; our favorite new iOS 7 beta 3 features; researchers know where you'll take your iPhone next; Alex E...		http://thecultcast.libsyn.com/cult-cast-81-room-for-squares	1843.0	20639975	0
2020-03-25 19:19:38			2020-03-25 19:19:38		0		CultCast #190 - London Handshake	This week: why we might be in for big iPad upgrades this year; our expectations for the iPhone 6C; the one feature we hope iPhone 6S will get (but probably won’t); Woz is worried about Skynet again; and… is Apple building machine for time...		http://thecultcast.libsyn.com/cultcast-190-london-handshake	3512.0	89518807	0
2020-03-25 19:19:38			2020-03-25 19:19:38		0		CultCast #106 - Christmas Quickie	Ho Ho Ho, it's Christmas CultCast time!  This episode: a new deal in China hands Apple 770 million potential new customers; we cover some of the wackiest rumors of 2013; the Mac Pro delivers surprising results in performance tests; some of the...		http://thecultcast.libsyn.com/cult-cast-106-christmas-quickie	1617.0	19482796	0
2020-03-25 19:19:38			2020-03-25 19:19:38		0		CultCast #289 - The powerful iOS 11 features you haven’t heard of 💪🏼	This week:    More of the powerful new iOS 11 features you’ve never heard of.  The talented app which will harnesses the power of Apple’s  new augmented reality features   Scott Forstall is back, and he’s sharing the bizarre...		http://thecultcast.libsyn.com/cultcast-289-the-powerful-ios-11-features-you-havent-heard-of	3044.0	74944894	0
2020-03-25 19:19:38			2020-03-25 19:19:38		0		CultCast #90 - Subject To Change	Hot off the Apple event—it's our iPhone 5S and 5C reactions on our all-new CultCast.  We'll take a look at what's new in iOS 7 and each new iPhone, and we'll walk step-by-step through all the powerful new tech Apple unveiled throughout...		http://thecultcast.libsyn.com/cult-cast-90-subject-to-change	3411.0	27517224	0
2020-03-25 19:19:38			2020-03-25 19:19:38		0		CultCast #270 - The BEST Apple discounts	This week:   How to get significant discounts on Apple gadgets The INSANELY SPECIAL doorknobs at Apple’s Spaceship HQ The fat paychecks earned by Jony Ive’s industrial designers  iPhone 8 to come in a plus plus size Wireless...		http://thecultcast.libsyn.com/cultcast-270-the-best-apple-discounts	2956.0	55171831	0
2020-03-25 19:19:38			2020-03-25 19:19:38		0		#387 - WWDC 2019, revealed!	This week: WWDC 2019 is right around the corner, and a new report sheds light on everything Apple's prepping to reveal. We discuss! Plus: the magic of Corning glass, and how making your iPhone just slightly thicker would make it indestructible. And we...		http://thecultcast.libsyn.com/387-wwdc-2019-revealed	3229.0	52771573	0
2020-03-25 19:19:38			2020-03-25 19:19:38		0		CultCast #3 - We're So Excited That We Just Can't Hide It!	"Erfon, Leander, and Buster talk all about the ""new"" iPad and Apple TV!  We review iPad's new features;  is the Retina display a real retina display?; is it worth upgrading from the iPad 2?; then we discuss questions and comments from you,..."		http://thecultcast.libsyn.com/cult-cast-episode-3-we-re-so-excited-that-we-just-can-t-hide-it-	2417.0	39737913	0
2020-03-25 19:19:38			2020-03-25 19:19:38		0		CultCast #179 - Code Brown	This week: why the iPhone 6s could be the biggest “S” update yet; Nintendo promises 5 top-notch titles coming to iOS; the paltry earnings of top Mac App Store apps; and just when we thought we’ve seen every iPhone...		http://thecultcast.libsyn.com/cultcast-179-code-brown	2616.0	60381049	0
2020-03-25 19:19:38			2020-03-25 19:19:38		0		CultCast #101 - It That An iShield?	Apple and a 12.9-inch iPad; the first iOS 7 game controller is long overdue; Retina iPad Minis are *almost* perfect; strategies to backup all those iPhone photos you take; and Adam Christianson from the Maccast podcast joins us on this time on The...		http://thecultcast.libsyn.com/cult-cast-101-it-that-an-i-shield	2764.0	33276309	0
2020-03-25 19:19:38			2020-03-25 19:19:38		0		CultCast #367: How Mac clones almost destroyed Apple, and our favorite movies of 2018!	This week: In December of 1994, Apple began allowing PC manufacturs to license their OS, building their own versions of the “Mac”, and it almost destroyed them. Leander Kahney was a young reporter on the scene in those days, and regales us with...		http://thecultcast.libsyn.com/cultcast-367-how-mac-clones-almost-destroyed-apple-and-our-favorite-movies-of-2018	4880.0	77349067	0
2020-03-25 19:19:38			2020-03-25 19:19:38		0		CultCast #296 - What’s next for  Watch?	This week:  what does Apple have in store for the next version of  Watch?  We’ll roundup the current rumors and reveal our Gen 3 wish list.  Then: could Face ID actually replace Touch ID on iPhone 8?  We have...		http://thecultcast.libsyn.com/cultcast-296-whats-next-for-watch	4123.0	82582823	0
2020-03-25 19:19:38			2020-03-25 19:19:38		0		CultCast # 61 - Google Glassholes	"With over 205,000 Instagram followers, iPhone photographer Cory aka @withhearts knows a thing or two about how to capture beautiful photos on Apple's beloved iDevice.

He joins us on this CultCast to reveil his favorite editing apps, tips, and secrets..."		http://thecultcast.libsyn.com/cult-cast-61-google-glassholes	4489.0	36040120	0
2020-03-25 19:19:38			2020-03-25 19:19:38		0		CultCast #142 - iWatch is Nigh!	This week: Mark your calendars for Sept. 9th, friends, cause iWatch is nigh!  Plus, an insanely accurate iPhone 6 leak hits Youtube; the apps we use to send our friends and family money; why everyone’s buzzing about Hyperlapse; rumors of a...		http://thecultcast.libsyn.com/cultcast-142-iwatch-is-nigh	2811.0	60681941	0
2020-03-25 19:19:38			2020-03-25 19:19:38		0		CultCast #39 - We Like, Thin, iMacs And We Can-not Lie	"Kindle; Nexus; Surface—they're all doomed, and on this week's CultCast, we'll tell why Apple's new iPad mini will most definitely sit as the king of all tabs small.
Then, we review a new social iOS game so stellar, it'll have you clamoring for..."		http://thecultcast.libsyn.com/cult-cast-39-we-like-thin-i-macs-and-we-can-not-lie	2250.0	38934255	0
2020-03-25 19:19:38			2020-03-25 19:19:38		0		CultCast #11 - The One App To Rule Them All	You asked for it, you got it!  In this jammed-packed episode we reveal our favorite apps of the week, then vote on which app shall reign supreme!  But first, we yay and nay our way through some iPhone 5 and Apple rumors — are we really...		http://thecultcast.libsyn.com/cult-cast-11-the-one-app-to-rule-them-all	3194.0	42964899	0
2020-03-25 19:19:38			2020-03-25 19:19:38		0		CultCast #363 - Apple’s super secret exchange policy	This week: Did you know about Apple’s super secret 90-day return and exchange policy?  We’ll tell you what it is, and how to use it if you’re unhappy with your Apple purchase, but outside of your 14-day return window.  Plus: quest to...		http://thecultcast.libsyn.com/cultcast-363-apples-super-secret-exchange-policy	2815.0	54069742	0
2020-03-25 19:19:38			2020-03-25 19:19:38		0		CultCast #123 - Private Parts	Back in September, popular Youtuber Lewis Hilsenteger released a hands-on video of what he believed to be the outer shell of the iPad 5.  The video exploded on the internet, and 6 weeks later when Apple announced the iPad Air, it confirmed his...		http://thecultcast.libsyn.com/cultcast-123-private-parts	3584.0	52133117	0
2020-03-25 19:19:38			2020-03-25 19:19:38		0		CultCast #233 - Mr. Meme	This week: Macbook Pro about to get its biggest refresh ever!  Plus: Apple’s plans to rival Amazon’s Echo; Apple gets serious about iCar charging stations; more great stories from the Cult of Mac; the state of gaming in OS X, iOS, and tvOS;...		http://thecultcast.libsyn.com/cultcast-233-mr-meme	4165.0	64567403	0
2020-03-25 19:19:38			2020-03-25 19:19:38		0		Let's talk about games! CC Off Topic #2, with the AMAZING Aaron Hughes	Two life-long playas talk about their favorite games, and which future titles they're most excited for.		http://thecultcast.libsyn.com/lets-talk-about-games-cc-off-topic-2-with-the-amazing-aaron-hughes	3220.0	52612644	0
2020-03-25 19:19:38			2020-03-25 19:19:38		0		CultCast #222 - Secret man-tears	This week: it’s official, Apple is gonna “loop us in” at their March 21 press event.  Join us as we decode the mysterious event invitation.  Plus:  some new leaks give us glimpses at the iPhone SE and iPhone 7 designs;...		http://thecultcast.libsyn.com/cultcast-222-secret-man-tears	2501.0	45790865	0
2020-03-25 19:19:38			2020-03-25 19:19:38		0		CultCast #343 - Mac refresh, incoming!	This week:   New evidence just today that Apple has a big Mac refresh right around the corner.   MacBook Pro is about to get the new feature we’ve all been wanting.   Apple is rebuilding their maps app from the ground up, and it looks magnificent.  ...		http://thecultcast.libsyn.com/cultcast-343-mac-refresh-incoming	2910.0	55581083	0
2020-03-25 19:19:38			2020-03-25 19:19:38		0		CultCast #134 - Protect Your Appendages	USA!  USA!  On this festive new episode, we reveal our favorite 4th activities and it’s clear Alex E Heath will be in jail by the 5th.  Plus!  A weird breakthrough app has us texting hodor to all our friends; Apple kills off Aperture...		http://thecultcast.libsyn.com/cultcast-134-protect-your-appendages	2664.0	51629677	0
2020-03-25 19:19:38			2020-03-25 19:19:38		0		CultCast #198 - #HeftGate	This week: the embargoes have lifted and the iPhone 6s reviews are in—we’ll tell you what people love—and don’t—about Apple's newest iPhone.  Plus: Apple car coming in 2019; why we love the new watchOS 2...		http://thecultcast.libsyn.com/cultcast-198-heftgate	4138.0	114816242	0
2020-03-25 19:19:38			2020-03-25 19:19:38		0		CultCast #116 - The Best Is Yet To Come!	"Hallelujah, iOS has come to the car! On this week’s CultCast, we’ll tell you all we love and don’t about Apple’s new CarPlay-enabled automobiles.  
Plus: why Apple’s best years are still to come; why iOS 7.1 could..."		http://thecultcast.libsyn.com/cultcast-116-the-best-is-yet-to-come	3802.0	62605478	0
2020-03-25 19:19:38			2020-03-25 19:19:38		0		CultCast #188 - He’s got legs	This week: We all love the popular products, but this ep. we’ll remember some of Apple’s biggest blunders!  Plus: why the new iPods might be the last iPods; Apple’s missing back to school promotion; and perfect way to...		http://thecultcast.libsyn.com/cultcast-188-hes-got-legs	3337.0	79723049	0
2020-03-25 19:20:21			2020-03-25 19:20:21		0	Douglas A. Brush | Weekly Interviews w/ InfoSec Pros	#027 – Lance Spitzner: What Behaviors Do We Care About	Lance Spitzner is the Director of the SANS Security Awareness program. Lance has over 20 years of security experience in cyber threat research, awareness, and training. He invented the concept of honeynets, founded the Honeynet Project, and published three security books. Lance has worked and consulted in over 25 countries and helped over 350 organizations…		https://cybersecurityinterviews.com	2690.0	43081729	0
2020-03-25 19:20:21			2020-03-25 19:20:21		0	Douglas A. Brush | Weekly Interviews w/ InfoSec Pros	#016 – Kristin Lovejoy: Security Is a Team Sport	Kristin Lovejoy is the CEO of BluVector. Prior to her role at BluVector, she served as general manager of IBM’s Security Services Division, charged with development and delivery of managed and professional security services to IBM clients worldwide. In addition, she served as IBM’s Global CISO and VP of IT Risk. Kris is a recognized…		https://cybersecurityinterviews.com	3131.0	50138434	0
2020-03-25 19:20:21			2020-03-25 19:20:21		0	Douglas A. Brush | Weekly Interviews w/ InfoSec Pros	#082 – Jamil Jaffer: Not All Nation-state Activity Is the Same	IronNet (https://ironnet.com/about/news/) , a startup technology firm founded by former National Security Agency (NSA) Director Gen. Keith Alexander (ret.). Prior to joining IronNet, Jamil served as the Chief Counsel and Senior Advisor for the Senate Foreign Relations Committee and Senior Counsel to the House Intelligence Committee where he led the committee’s oversight of NSA surveillance and wrote the original version of the Cybersecurity Information Sharing Act (CISA) signed into law in 2015. He also worked in the White House during the Bush Administration as an Associate Counsel to the President and in the Justice Department where he led the National Security Division's work on the President's Comprehensive National Cybersecurity Initiative. Jamil is also an Assistant Professor of Law and Director of the National Security Law & Policy Program at the Antonin Scalia Law School at George Mason University and a Visiting Fellow at Stanford University’s Hoover Institution. In this episode, we discuss starting as in legal, government's role in cybersecurity, information sharing with real-time collaboration, automation, trend spotting, impacts to small businesses, cyberwar, and so much more. Where you can find Jamil: LinkedIn (https://www.linkedin.com/in/jamil-jaffer-199115/) Twitter (https://twitter.com/jamil_n_jaffer) IronNet (https://ironnet.com/about/news/)		https://cybersecurityinterviews.com	2241.0	53864295	0
2020-03-25 19:20:21			2020-03-25 19:20:21		0	Douglas A. Brush | Weekly Interviews w/ InfoSec Pros	#024 – Independence	This is another short podcast before we get back into full interviews next week. In this episode, I explore the concept of Independence. In the US, this week we are celebrating Independence Day. This got me thinking about what that means in my business experience. I wanted to share a few observations for those who are thinking about going out on their…		https://cybersecurityinterviews.com	334.0	5384097	0
2020-03-25 19:20:21			2020-03-25 19:20:21		0	Douglas A. Brush | Weekly Interviews w/ InfoSec Pros	#060 – Mike Johnson: Let’s Do The Right Thing	Mike Johnson is the CISO of Lyft, where he is responsible for Security, Data Privacy, and a few other key areas he can’t talk about. He’s been in the security field long enough to be able to use “decades” as a measure. In his time he’s seen things, heard things, and shared his opinion on…		https://cybersecurityinterviews.com	2931.0	45674132	0
2020-03-25 19:20:21			2020-03-25 19:20:21		0	Douglas A. Brush | Weekly Interviews w/ InfoSec Pros	#054 – Brian Vecci: Understanding the Value of What We Have	Brian Vecci is the Technical Evangelist at Varonis where he supports a wide range of security initiatives by helping Varonis’ customers and employees get the most out of the company’s products to tackle today’s biggest security challenges. In his 20-year technical career, Brian served as a developer, tech architect, engineer and product manager for companies in financial…		https://cybersecurityinterviews.com	2730.0	43723477	0
2020-03-25 19:20:21			2020-03-25 19:20:21		0	Douglas A. Brush | Weekly Interviews w/ InfoSec Pros	#001 – Chris Pogue: Like a Chihuahua On a Pork Chop	Chris Pogue, Chief Information Security Officer at Nuix, has more than fifteen years’ experience and 2,000 breach investigations under his belt. Over his career, Chris has led multiple professional security services organizations and corporate security initiatives to investigate thousands of security breaches worldwide. His extensive experience is drawn from careers as a cyber crimes investigator,…		https://cybersecurityinterviews.com	2936.0	47023923	0
2020-03-25 19:20:21			2020-03-25 19:20:21		0	Douglas A. Brush | Weekly Interviews w/ InfoSec Pros	#071 – Renaud Deraison: Complexity Breeds Insecurity	Renaud Deraison is known in the global security community as the father of the Nessus vulnerability scanner. His original creation, Nessus, celebrated its 15th anniversary in 2013 and is considered the de facto standard for vulnerability scanning worldwide. Renaud co-founded Tenable Network Security in 2002. As Chief Technology Officer, he drives product strategy and development.…		https://cybersecurityinterviews.com/071-renaud-deraison-complexity-breeds-insecurity/	1607.0	21763979	0
2020-03-25 19:20:21			2020-03-25 19:20:21		0	Douglas A. Brush | Weekly Interviews w/ InfoSec Pros	#075 – Brian Martin (Jericho): The Hacker Mindset	Brian Martin (a.k.a. Jericho) has been poking about the hacker and security scene for over 22 years, building valuable skills such as skepticism and anger management. As a hacker-turned-security whore, Jericho has a great perspective to offer an unsolicited opinion on just about any security topic. A long-time advocate of advancing the field, sometimes by…		https://cybersecurityinterviews.com/075-brian-martin-jericho-hacker-mindset/	2902.0	40921723	0
2020-03-25 19:20:21			2020-03-25 19:20:21		0	Douglas A. Brush | Weekly Interviews w/ InfoSec Pros	#006 – 2016: A Look Back Through the Year	This is going to be one of two special holiday break episodes as we end out the year. We will be returning to our regular interviews with top security experts right after the start of the new year. In this episode, I reflect on 2016 and cyber security. It was an interesting year and information…		https://cybersecurityinterviews.com	463.0	7450223	0
2020-03-25 19:20:21			2020-03-25 19:20:21		0	Douglas A. Brush | Weekly Interviews w/ InfoSec Pros	#012 – Cindy Murphy: Learn How To Learn	Cindy Murphy served in law enforcement  for more than thirty years (twenty-five of those years at the Madison Police Department in Wisconsin) before leaving the force to launch Gillware Digital Forensics, where she is co-owner and serves as president and lead examiner. Her peers have called her “one of the most dedicated people in the field of digital…		https://cybersecurityinterviews.com	3907.0	62568611	0
2020-03-25 19:20:21			2020-03-25 19:20:21		0	Douglas A. Brush | Weekly Interviews w/ InfoSec Pros	#013 – Gary McGraw: Security Is Hard Work	Dr. Gary McGraw is the Vice President of Security Technology at Synopsys (SNPS). Gary quite literally helped create the field of software security. He is a globally recognized authority on software security and the author of several bestselling books on this topic. His titles include Software Security, Exploiting Software, Building Secure Software, Java Security, Exploiting Online…		https://cybersecurityinterviews.com	3174.0	50838978	0
2020-03-25 19:20:21			2020-03-25 19:20:21		0	Douglas A. Brush | Weekly Interviews w/ InfoSec Pros	#072 – Vinny Sakore: This Was Crime	Vinny Sakore joined the NetDiligence team in 2017 as their Chief Technology Officer. Prior to joining NetDiligence Vinny served as Verizon’s HIPAA Security Officer. His previous experience includes stints as Chief Technology Officer for two healthcare technology companies. Vinny is a featured speaker nationally and internationally on the topics of Cyber Risk, Mobile Technology, and…		https://cybersecurityinterviews.com/072-vinny-sakore-crime/	2345.0	39750942	0
2020-03-25 19:20:21			2020-03-25 19:20:21		0	Douglas A. Brush | Weekly Interviews w/ InfoSec Pros	#078 – Nadean Tanner: Boil It Down	"When my 7-year-old introduced me to his second-grade class, he put it best: ""My Mom teaches the good guys how to keep the bad guys out of their computers. She has a blue lightsaber.""

- Nadean Tanner

Nadean Tanner is the Senior Manager of Technical Education Programs at Puppet. She is responsible for all things product training from working with internal knowledge sources and the instructional design team to produce modern, engaging knowledge assets to delivering online and onsite classroom sessions. 

Nadean is an experienced instructor and speaker with nearly 20 years' experience in information technology and security training delivery and development. At Rapid7, she taught vulnerability management and network and application assault as well as SQL, Ruby, and API. Before Rapid 7, Nadean taught Security Analytics and Advanced Security Operations Center Management for RSA. She taught cybersecurity and information assurance 8570 classes for the Department of Defense including CISSP at Fort Gordon, Fort Carson, and the Pentagon, and she developed and taught graduate-level computer science courses at Louisiana State University for six years.

In this episode, we discuss teaching and traveling, communicating technical terms, talking about the basics, writing a book, teaching with humility, knowing when you are an expert, and so much more."		https://cybersecurityinterviews.com	2679.0	64325469	0
2020-03-25 19:20:21			2020-03-25 19:20:21		0	Douglas A. Brush | Weekly Interviews w/ InfoSec Pros	#079 – Mari DeGrazia: Not Just One Technology	Mari DeGrazia is a senior director in the Cyber Risk practice of Kroll, a division of Duff & Phelps. Over the course of a 12-year career in the computer industry, Mari has become a leader within the digital forensics community. Mari joined Kroll from Verizon Enterprises where she served as Case Lead on various network intrusion and data breach investigations. Mari is a strong believer in giving back to the forensic community and has written and released numerous programs/scripts, two of which are used in SANS training. In addition, she has presented her research at several industry conferences, published articles in eForensics Magazine, and was the technical editor for Windows Registry Forensics S.E. In this episode, we discuss starting in IT, balancing work and family, self-training, the importance of the DFIR community, cross-training, using AI for detection, cloud security, giving back to the industry, and so much more.		https://cybersecurityinterviews.com	2679.0	64341129	0
2020-03-25 19:20:21			2020-03-25 19:20:21		0	Douglas A. Brush | Weekly Interviews w/ InfoSec Pros	#065 – Lizzie Cookson: Attackers Adapt With Us	Lizzie Cookson is an Associate Director of Cyber Investigations at Kivu Consulting. She specializes in cyber extortion and threat intelligence with a focus on attacker negotiations, threat actor profiling, and data breach remediation. Lizzie’s case work has included network intrusions, e-commerce compromise, business email compromise, wire/tax fraud, employee misconduct, and over 150 cyber extortion investigations.…		https://cybersecurityinterviews.com	2471.0	33524219	0
2020-03-25 19:20:21			2020-03-25 19:20:21		0	Douglas A. Brush | Weekly Interviews w/ InfoSec Pros	#041 – Andrew Hay: Creative Solutions to Hard Problems	Andrew Hay is an information security industry veteran with close to 20 years of experience as a security practitioner, industry analyst, and executive. As the Co-Founder & Chief Technology Officer (CTO) for LEO Cyber Security, he is a member of the senior executive leadership team responsible for the creation and driving of the strategic vision…		https://cybersecurityinterviews.com	2169.0	34741670	0
2020-03-25 19:20:21			2020-03-25 19:20:21		0	Douglas A. Brush | Weekly Interviews w/ InfoSec Pros	#018 – Hal Pomeranz: Take a Deep Breath and Relax	Hal Pomeranz is the Founder and Principal Consultant for Deer Run Associates with over 25 years of cyber security experience. As a digital forensic investigator, Hal has consulted on cases ranging from intellectual property theft, to employee sabotage, to organized cybercrime, and malicious software infrastructures. He has worked with law enforcement agencies in the United…		https://cybersecurityinterviews.com	3046.0	73155543	0
2020-03-25 19:20:21			2020-03-25 19:20:21		0	Douglas A. Brush | Weekly Interviews w/ InfoSec Pros	#035 – David Kovar: Where Is the Best Application of Your Skill Set	David Kovar is the President and founder of Kovar & Associates where he leads the development of URSA – Unmanned & Robotics Systems Analysis – a suite of tools designed to collect, integrate, analyze, and present UAV related data for many purposes including fleet management, criminal investigations, failure analysis, and predictive analysis. He also leads…		https://cybersecurityinterviews.com	3162.0	50630817	0
2020-03-25 19:20:21			2020-03-25 19:20:21		0	Douglas A. Brush | Weekly Interviews w/ InfoSec Pros	#034 – Harlan Carvey: You Have To Apply the Data To Your Theory	Harlan Carvey is currently the Director of Intelligence Integration at Nuix. Harlan has been involved in information security for 28 years, which began during his military career. After leaving active duty 20 years ago, he started in consulting, performing vulnerability assessments and penetration testing. From there, it was a natural progression to digital forensics and incident…		https://cybersecurityinterviews.com	3656.0	58540853	0
2020-03-25 19:20:21			2020-03-25 19:20:21		0	Douglas A. Brush | Weekly Interviews w/ InfoSec Pros	#039 – James Tarala: What Does the Risk Really Look Like	James Tarala is a principal consultant with Enclave Security and is based out of Venice, Florida. James Tarala has been a speaker with the SANS Institute, the Institute of Applied Network Security (IANS), and the Center for Internet Security for over 20 years. He has spoken at RSA for numerous years and has enjoyed the…		https://cybersecurityinterviews.com	2834.0	45388540	0
